Question,Answer,Source,Date Retrieved
Can coronavirus travel by wind ,"Coronavirus cannot travel very far in the air, the World Health Organization says. ",Cable News Network,29-Apr-20
Should I stop wearing contacts and switch to glasses ,There is no evidence to suggest contact lens wearers are more at risk for acquiring COVID-19 than eyeglass wearers.,Cable News Network,29-Apr-20
"Can you safely reuse a non-cloth mask that you can’t wash, like a disposable mask ","Yes you can, said Dr. Joseph Vinetz, an infectious diseases professor at Yale School of Medicine. ",Cable News Network,29-Apr-20
What’s so different about coronavirus that we have to shut down businesses ,"Unlike SARS and swine flu, the novel coronavirus is both highly contagious and especially deadly, CNN Chief Medical Correspondent Dr. Sanjay Gupta said. ",Cable News Network,29-Apr-20
"Will ingesting or injecting disinfectants, like the ones that kill viruses on surfaces, protect me against coronavirus or kill coronavirus if I already have it ","“That’s a bad idea,” said Dr. Colleen Kraft, an infectious diseases professor at Emory University School of Medicine. “It could definitely kill you.” ",Cable News Network,29-Apr-20
Can mosquitoes transmit coronavirus,No. ,Cable News Network,29-Apr-20
Is it true young people with coronavirus are also having blood clots and strokes ,"Yes, some young adults have subered strokes after getting coronavirus. ",Cable News Network,29-Apr-20
Why worry about coronavirus when the flu kills so many people ,The number of Americans killed from Covid-19 and those who have died from the flu this season are now comparable. But deaths from Covid-19 are happening at a much faster rate. ,Cable News Network,29-Apr-20
Why can’t we just test everyone in the US ,"Doctors say it’s not realistic to test all 328 million people in the US, especially since many states are still struggling to get enough tests or testing supplies. ",Cable News Network,29-Apr-20
"Do I need to wash my clothes right after encountering other people, like at the grocery store or while jogging ","Coronavirus can stay alive for up to three days on stainless steel and plastic. But clothing is probably more like cardboard — it’s more absorbent, so the virus is unlikely to stay and last that long.",Cable News Network,29-Apr-20
Can coronavirus spread through water,There is no evidence that COVID-19 can be spread to humans through the use of pools and hot tubs.,Cable News Network,29-Apr-20
How can someone spread coronavirus when asymptomatic ,"When you speak, sometimes you’ll spit a little bit. You’ll rub your nose. You’ll touch your mouth. You’ll rub your eyes. And then you’ll touch other surfaces, and then you will be spreading virus if you are infected and shedding asymptomatically.",Cable News Network,29-Apr-20
Can you get coronavirus from touching money — either cash or coins ,Viruses can live on surfaces and objects — including on money — although your chance of actually getting COVID-19 from cash is probably very low.,Cable News Network,29-Apr-20
Will an antibody test show whether I’m immune and can go back to work ,"Not necessarily. Antibodies are a body’s response to bacteria or viruses. But this novel coronavirus is so new, it’s still not clear whether having antibodies to it means you have long-term protection from getting reinfected. ",Cable News Network,29-Apr-20
"If novel coronavirus antibodies may or may not offer long-term immunity, how would a vaccine help ","In some cases, a vaccine might give stronger protection than antibodies produced after being infected, epidemiologist. ",Cable News Network,29-Apr-20
What are the odds that the US can reopen by May 1 ,"“May 1st, I think, is completely unrealistic,” said Dr. Ashish Jha, director of the Harvard Global Health Institute. ",Cable News Network,29-Apr-20
Are some blood types able to fight this coronavirus better than other blood types ,"“With this respiratory virus, (as) with other coronaviruses, no,” said Dr. Maria Van Kerkhove, technical lead for the World Health Organization’s Covid-19 response. ",Cable News Network,29-Apr-20
Can I use vodka as hand sanitizer,The CDC advises using hand sanitizer that contains at least 60% alcohol. ,Cable News Network,29-Apr-20
Are smokers or vapers at higher risk,This is not a good time to be vaping or smoking anything. ,Cable News Network,29-Apr-20
Can I get coronavirus through food ,There’s no evidence that coronavirus can be transmitted through food.,Cable News Network,29-Apr-20
Does this pandemic have anything to do with the 5G network ,No. That’s just a hoax going around the internet. ,Cable News Network,29-Apr-20
How long does coronavirus stay “alive” on surfaces,"Up to three days, depending on the surface. ",Cable News Network,29-Apr-20
"After recovering from coronavirus, does a person have long-term immunity to the virus ",It’s too early to know for sure. ,Cable News Network,29-Apr-20
Will a pneumonia or flu vaccine help protect against coronavirus,Some cases of coronavirus do lead to pneumonia. But the pneumonia vaccine won’t help,Cable News Network,29-Apr-20
Should I wear a face mask in public,The CDC “recommends wearing cloth face coverings in public settings where other social distancing measures are diffcult to maintain.,Cable News Network,29-Apr-20
How long will we have to keep social distancing,"Probably for several months. But you might have to do it over and over again, since the outbreak could come in waves. ",Cable News Network,29-Apr-20
Why is a cure taking so long,"An antiviral drug must be able to target the specific part of a virus’s life cycle that is necessary for it to reproduce, according to Harvard Medical School.",Cable News Network,29-Apr-20
Why are medical workers getting sick with or dying from coronavirus if they’re wearing protective gear ,Many health care workers don’t actually have enough protective gear to handle the growing influx of coronavirus patients. ,Cable News Network,29-Apr-20
Can I have the flu and coronavirus at the same time,Yes. Testing positive for either the flu or coronavirus doesn’t exempt you from having the other at the same time. ,Cable News Network,29-Apr-20
Should all Americans be under stay-at-home orders,"“We really should be,” said Dr. Anthony Fauci, a member of the White House Coronavirus Task Force. ",Cable News Network,29-Apr-20
How many people with coronavirus don't have symptoms ,Recent studies suggest 25% to 50% of coronavirus carriers don’t have symptoms.,Cable News Network,29-Apr-20
"If there’s no cure, why go to the hospital unless you have a breathing problem ","Most coronavirus patients don’t need to be hospitalized. “The vast majority of people – about 80% – will do well without any specific intervention,” said Dr. Anthony Fauci, director of the National Institute of Allergy and Infectious Diseases. ",Cable News Network,29-Apr-20
Can high or low temperatures kill coronavirus ,"Generally coronaviruses survive for shorter periods of time at higher temperatures and higher humidity than in cooler or dryer environments. However, we don’t have direct data for this virus, nor do we have direct data for a temperature-based cutob for inactivation at this point, ",Cable News Network,29-Apr-20
Is the water supply at risk ,"No, the water supply is not at risk. ",Cable News Network,29-Apr-20
Is coronavirus more contagious than the flu ,"Yes. Research indicates a person with the flu infects about 1.28 other people, on average. But with the novel coronavirus, it’s likely between 2 and 3 other people.",Cable News Network,29-Apr-20
"If people can spread the virus without showing any symptoms, how can I tell who’s infected and who’s not ","You can’t, said Dr. James Phillips, chief of disaster and operational medicine at George Washington University Hospital. ",Cable News Network,29-Apr-20
How does this coronavirus spread,"It primarily spreads between people through respiratory droplets, like through coughs, sneezes, spittle. ",Cable News Network,29-Apr-20
How long is someone contagious after getting coronavirus,It varies. Decisions about when a person can be released from isolation are made on a case-by-case basis. ,Cable News Network,29-Apr-20
What exactly does 'older' adults mean,The average age of death for people from coronavirus is 80. Average age of people who need medical attention is age 60.,Cable News Network,29-Apr-20
Are kids more at risk ,Younger people seem to be insulated to some extent to protect them from getting particularly sick.,Cable News Network,29-Apr-20
Is coronavirus especially harmful for pregnant women,Researchers do not have information from published scientific reports about susceptibility of pregnant women to this coronavirus.,Cable News Network,29-Apr-20
What can I do if my loved one suspects they have coronavirus ,Don’t visit family members with suspected illness – keep up with them virtually. ,Cable News Network,29-Apr-20
Should I disinfect my groceries,"“I would suggest wiping down external surfaces of canned or wrapped foods,” said Dr. Celine Gounder, an infectious disease specialist at Bellevue Hospital Center. ",Cable News Network,29-Apr-20
Should I stock up on extra food and supplies,"Yes, because a family member may suddenly have to quarantine. ",Cable News Network,29-Apr-20
Should I avoid public transportation,"If you rely on public transportation, use caution. If you’re sick or live in an area where an outbreak has been reported, avoid it. ",Cable News Network,29-Apr-20
How do I stay healthy while using Uber or Lyft,Both rideshare companies said they’re actively trying to protect customers and drivers from coronavirus. ,Cable News Network,29-Apr-20
Is it safe for me to vote at a polling location,States have received guidance from the CDC on how to keep voting locations clean. It’s up to you whether you feel comfortable going. ,Cable News Network,29-Apr-20
Should I go to work,"If you can, you should stay home from work when you’re sick, whether or not you have coronavirus. ",Cable News Network,29-Apr-20
Can I be fired if I stay home sick ,An employee can be fired if they don’t show up to work and they don’t have sick leave that would cover the absence.,Cable News Network,29-Apr-20
What happens when workers don't get paid sick leave,"The Family and Medical Leave Act (FMLA) can sometimes protect a worker’s job in the event they get sick, but it won’t guarantee they get paid while they’re out. ",Cable News Network,29-Apr-20
Can managers send a sick worker home ,"Yes, managers can. ",Cable News Network,29-Apr-20
"If traveling on a plane, how do I stay safe",It’s not the cabin air you need to worry about. It’s keeping your hands clean. ,Cable News Network,29-Apr-20
"Since a plane's cabin keeps circulating air, will I get sick if another passenger is sick ",Most viruses don’t spread easily on airplanes because of how the air circulates and is filtered.,Cable News Network,29-Apr-20
"If I have a weakened immune system, should I cancel my travel plans ","People who are immunocompromised are at higher risk from this illness, as well as other illnesses like the flu. Avoiding contact with ill people is crucial.",Cable News Network,29-Apr-20
What do I do if I think I’m sick,Stay home. Call your doctor to talk about your symptoms and let them know you’re coming for an appointment so they can prepare for your visit.,Cable News Network,29-Apr-20
What’s the best way to prevent coronavirus,"Stay at least 6 feet away from others, and wash your hands often. ",Cable News Network,29-Apr-20
Should I spray myself or my kids with disinfectant,No. Those products work on surfaces but can be dangerous to your body. ,Cable News Network,29-Apr-20
I’ve heard that home remedies can cure or prevent the virus. Is that true ,"There’s no evidence from the outbreak that eating garlic, sipping water every 15 minutes or taking vitamin C will protect people from the new coronavirus. ",Cable News Network,29-Apr-20
"If infected with coronavirus, can you survive it and recover ",Absolutely. The vast majority of people with coronavirus survive. ,Cable News Network,29-Apr-20
How long does it take to recover,It takes anything up to six weeks to recover from this disease.,Cable News Network,29-Apr-20
Why waste a test kit on a person without symptoms,"Some people with coronavirus have mild or no symptoms. And in some cases, symptoms don’t appear until up to 14 days after infection. ",Cable News Network,29-Apr-20
Why is the US so far behind other countries with testing,Experts say it’s due to cuts in federal funding for public health and problems with early testing. ,Cable News Network,29-Apr-20
"If a coronavirus patient progresses to pneumonia, what antibiotics if any have proven to be effective ","No, antibiotics are not effective against coronavirus because the disease is a viral infection, not a bacterial infection. ",Cable News Network,29-Apr-20
Can the heat from a hand dryer kill coronavirus ,Hand dryers can’t kill the virus.,Cable News Network,29-Apr-20
Can I get coronavirus from a package sent from China,No. The new coronavirus cannot be transmitted through goods manufactured in China or any country reporting Covid-19 cases ,Cable News Network,29-Apr-20
,,Cable News Network,29-Apr-20
,,Cable News Network,29-Apr-20