Category,Question ID,Question,Source,Answers
Speculation - Pandemic Duration,42,will covid end soon,Google Search,"may 1st, i think, is completely unrealistic, said dr. ashish jha, director of the harvard global health institute. , probably for several months. but you might have to do it over and over again, since the outbreak could come in waves. "
Speculation - Pandemic Duration,42,will covid end,Yahoo Search,"may 1st, i think, is completely unrealistic, said dr. ashish jha, director of the harvard global health institute. , probably for several months. but you might have to do it over and over again, since the outbreak could come in waves. "
Speculation - Pandemic Duration,42,when covid will be over,Google Search,"may 1st, i think, is completely unrealistic, said dr. ashish jha, director of the harvard global health institute. , probably for several months. but you might have to do it over and over again, since the outbreak could come in waves. "
Speculation - Pandemic Duration,42,when covid lockdown ends,Google Search,"may 1st, i think, is completely unrealistic, said dr. ashish jha, director of the harvard global health institute. , probably for several months. but you might have to do it over and over again, since the outbreak could come in waves. "
Speculation - Pandemic Duration,42,will covid go away,Google Search,"may 1st, i think, is completely unrealistic, said dr. ashish jha, director of the harvard global health institute. , probably for several months. but you might have to do it over and over again, since the outbreak could come in waves. "
Speculation - Pandemic Duration,42,when covid will end,Yahoo Search,"may 1st, i think, is completely unrealistic, said dr. ashish jha, director of the harvard global health institute. , probably for several months. but you might have to do it over and over again, since the outbreak could come in waves. "
Speculation - Pandemic Duration,42,will covid ever go away,Google Search,"may 1st, i think, is completely unrealistic, said dr. ashish jha, director of the harvard global health institute. , probably for several months. but you might have to do it over and over again, since the outbreak could come in waves. "
Speculation - Pandemic Duration,42,when covid over,Google Search,"may 1st, i think, is completely unrealistic, said dr. ashish jha, director of the harvard global health institute. , probably for several months. but you might have to do it over and over again, since the outbreak could come in waves. "
Speculation - Pandemic Duration,42,will covid ever end,Bing Search,"may 1st, i think, is completely unrealistic, said dr. ashish jha, director of the harvard global health institute. , probably for several months. but you might have to do it over and over again, since the outbreak could come in waves. "
Speculation - Pandemic Duration,42,when covid ends,Yahoo Search,"may 1st, i think, is completely unrealistic, said dr. ashish jha, director of the harvard global health institute. , probably for several months. but you might have to do it over and over again, since the outbreak could come in waves. "
Speculation - Pandemic Duration,42,when covid is over,Google Search,"may 1st, i think, is completely unrealistic, said dr. ashish jha, director of the harvard global health institute. , probably for several months. but you might have to do it over and over again, since the outbreak could come in waves. "
Speculation - Pandemic Duration,42,how long will we have to keep social distancing,Cable News Network,"may 1st, i think, is completely unrealistic, said dr. ashish jha, director of the harvard global health institute. , probably for several months. but you might have to do it over and over again, since the outbreak could come in waves. "
Speculation - Pandemic Duration,42,will covid disappear,Bing Search,"may 1st, i think, is completely unrealistic, said dr. ashish jha, director of the harvard global health institute. , probably for several months. but you might have to do it over and over again, since the outbreak could come in waves. "
Speculation - Pandemic Duration,42,when covid end,Bing Search,"may 1st, i think, is completely unrealistic, said dr. ashish jha, director of the harvard global health institute. , probably for several months. but you might have to do it over and over again, since the outbreak could come in waves. "
Speculation - Pandemic Duration,42,when covid will stop,Yahoo Search,"may 1st, i think, is completely unrealistic, said dr. ashish jha, director of the harvard global health institute. , probably for several months. but you might have to do it over and over again, since the outbreak could come in waves. "
Speculation - Pandemic Duration,42,will covid be gone by summer,Yahoo Search,"may 1st, i think, is completely unrealistic, said dr. ashish jha, director of the harvard global health institute. , probably for several months. but you might have to do it over and over again, since the outbreak could come in waves. "
Speculation - Pandemic Duration,42,will covid go away in spring,Yahoo Search,"may 1st, i think, is completely unrealistic, said dr. ashish jha, director of the harvard global health institute. , probably for several months. but you might have to do it over and over again, since the outbreak could come in waves. "
Speculation - Pandemic Duration,42,will covid die out,Yahoo Search,"may 1st, i think, is completely unrealistic, said dr. ashish jha, director of the harvard global health institute. , probably for several months. but you might have to do it over and over again, since the outbreak could come in waves. "
Speculation - Pandemic Duration,42,what is the official end date to covid,Yahoo Answers,"may 1st, i think, is completely unrealistic, said dr. ashish jha, director of the harvard global health institute. , probably for several months. but you might have to do it over and over again, since the outbreak could come in waves. "
Speculation - Pandemic Duration,42,how long will we be on lockdown for covid,Quora,"may 1st, i think, is completely unrealistic, said dr. ashish jha, director of the harvard global health institute. , probably for several months. but you might have to do it over and over again, since the outbreak could come in waves. "
Speculation - Pandemic Duration,42,how long do you think the covid pandemic will last in america,Quora,"may 1st, i think, is completely unrealistic, said dr. ashish jha, director of the harvard global health institute. , probably for several months. but you might have to do it over and over again, since the outbreak could come in waves. "
Speculation - Pandemic Duration,42,when will the covid virus end,Quora,"may 1st, i think, is completely unrealistic, said dr. ashish jha, director of the harvard global health institute. , probably for several months. but you might have to do it over and over again, since the outbreak could come in waves. "
Speculation - Pandemic Duration,42,when will covid end and covid 20 start,Quora,"may 1st, i think, is completely unrealistic, said dr. ashish jha, director of the harvard global health institute. , probably for several months. but you might have to do it over and over again, since the outbreak could come in waves. "
Speculation - Pandemic Duration,42,is covid likely to be at pandemic proportions for two years,Quora,"may 1st, i think, is completely unrealistic, said dr. ashish jha, director of the harvard global health institute. , probably for several months. but you might have to do it over and over again, since the outbreak could come in waves. "
Speculation - Pandemic Duration,42,will covid be gone this year,Quora,"may 1st, i think, is completely unrealistic, said dr. ashish jha, director of the harvard global health institute. , probably for several months. but you might have to do it over and over again, since the outbreak could come in waves. "
Speculation - Pandemic Duration,42,how long will social distancing for covid last,Quora,"may 1st, i think, is completely unrealistic, said dr. ashish jha, director of the harvard global health institute. , probably for several months. but you might have to do it over and over again, since the outbreak could come in waves. "
Speculation - Pandemic Duration,42,will covid stay and last forever,Quora,"may 1st, i think, is completely unrealistic, said dr. ashish jha, director of the harvard global health institute. , probably for several months. but you might have to do it over and over again, since the outbreak could come in waves. "
Speculation - Pandemic Duration,42,when will life get back to normal after the onset of covid,Quora,"may 1st, i think, is completely unrealistic, said dr. ashish jha, director of the harvard global health institute. , probably for several months. but you might have to do it over and over again, since the outbreak could come in waves. "
Transmission - Demographics: General,92,who is at higher risk,Illinois Department of Public Health,"older adults and people of any age who have serious underlying medical conditions may be at higher risk for more serious complications from covid., based on available evidence, children do not appear to be at higher risk for covid than adults. , the risk depends on where you are   and more specifically, whether there is a covid outbreak unfolding there. , we do not have information from published scientific reports about the susceptibility of pregnant women to covid. pregnant women experience immunologic and physiologic changes, which might make them more susceptible to viral respiratory infections, including covid. , smoking cigarettes can leave you more vulnerable to respiratory illnesses such as covid. smoking cigarettes is known to cause heart and lung disease and people with underlying heart and lung problems may have increased risk for serious complications from covid., e cigarette use can expose the lungs to toxic chemicals, but whether those exposures increase the risk of covid or the severity of covid outcomes is not known., this is not a good time to be vaping or smoking anything. , younger people seem to be insulated to some extent to protect them from getting particularly sick., researchers do not have information from published scientific reports about susceptibility of pregnant women to this covid., based on available evidence, children do not appear to be at higher risk for covid than adults. , based on currently available information and clinical expertise, older adults and people of any age who have serious underlying medical conditions might be at higher risk for severe illness from covid. , its not known yet whether all of these children are at higher risk for severe illness from covid., most people with disabilities are not inherently at higher risk for becoming infected with or having severe illness from covid., those in complex humanitarian crises, which lack the infrastructure, support, and health systems to mount a comprehensive response. , patients with underlying medical conditions and the elderly, smokers were 1.4 times more likely (rr1.4, 95% ci 0.98 2.00) to have severe symptoms of covid and approximately 2.4 times more likely to be admitted to an icu, need mechanical ventilation or die compared to non smokers (rr2.4, 95% ci 1.43 4.04), the risk depends on where you live or where you have travelled recently. the risk of infection is higher in areas where a number people have been diagnosed with covid. , while we are still learning about how covid 2019 affects people, older persons and persons with pre existing medical conditions (such as high blood pressure, heart disease, or diabetes) appear to develop serious illness more often than others."
Transmission - Demographics: General,92,what is the risk of my child becoming sick with covid,Center for Disease Control,"older adults and people of any age who have serious underlying medical conditions may be at higher risk for more serious complications from covid., based on available evidence, children do not appear to be at higher risk for covid than adults. , the risk depends on where you are   and more specifically, whether there is a covid outbreak unfolding there. , we do not have information from published scientific reports about the susceptibility of pregnant women to covid. pregnant women experience immunologic and physiologic changes, which might make them more susceptible to viral respiratory infections, including covid. , smoking cigarettes can leave you more vulnerable to respiratory illnesses such as covid. smoking cigarettes is known to cause heart and lung disease and people with underlying heart and lung problems may have increased risk for serious complications from covid., e cigarette use can expose the lungs to toxic chemicals, but whether those exposures increase the risk of covid or the severity of covid outcomes is not known., this is not a good time to be vaping or smoking anything. , younger people seem to be insulated to some extent to protect them from getting particularly sick., researchers do not have information from published scientific reports about susceptibility of pregnant women to this covid., based on available evidence, children do not appear to be at higher risk for covid than adults. , based on currently available information and clinical expertise, older adults and people of any age who have serious underlying medical conditions might be at higher risk for severe illness from covid. , its not known yet whether all of these children are at higher risk for severe illness from covid., most people with disabilities are not inherently at higher risk for becoming infected with or having severe illness from covid., those in complex humanitarian crises, which lack the infrastructure, support, and health systems to mount a comprehensive response. , patients with underlying medical conditions and the elderly, smokers were 1.4 times more likely (rr1.4, 95% ci 0.98 2.00) to have severe symptoms of covid and approximately 2.4 times more likely to be admitted to an icu, need mechanical ventilation or die compared to non smokers (rr2.4, 95% ci 1.43 4.04), the risk depends on where you live or where you have travelled recently. the risk of infection is higher in areas where a number people have been diagnosed with covid. , while we are still learning about how covid 2019 affects people, older persons and persons with pre existing medical conditions (such as high blood pressure, heart disease, or diabetes) appear to develop serious illness more often than others."
Transmission - Demographics: General,92,how likely am i to catch covid,Washington DC Area Television Station,"older adults and people of any age who have serious underlying medical conditions may be at higher risk for more serious complications from covid., based on available evidence, children do not appear to be at higher risk for covid than adults. , the risk depends on where you are   and more specifically, whether there is a covid outbreak unfolding there. , we do not have information from published scientific reports about the susceptibility of pregnant women to covid. pregnant women experience immunologic and physiologic changes, which might make them more susceptible to viral respiratory infections, including covid. , smoking cigarettes can leave you more vulnerable to respiratory illnesses such as covid. smoking cigarettes is known to cause heart and lung disease and people with underlying heart and lung problems may have increased risk for serious complications from covid., e cigarette use can expose the lungs to toxic chemicals, but whether those exposures increase the risk of covid or the severity of covid outcomes is not known., this is not a good time to be vaping or smoking anything. , younger people seem to be insulated to some extent to protect them from getting particularly sick., researchers do not have information from published scientific reports about susceptibility of pregnant women to this covid., based on available evidence, children do not appear to be at higher risk for covid than adults. , based on currently available information and clinical expertise, older adults and people of any age who have serious underlying medical conditions might be at higher risk for severe illness from covid. , its not known yet whether all of these children are at higher risk for severe illness from covid., most people with disabilities are not inherently at higher risk for becoming infected with or having severe illness from covid., those in complex humanitarian crises, which lack the infrastructure, support, and health systems to mount a comprehensive response. , patients with underlying medical conditions and the elderly, smokers were 1.4 times more likely (rr1.4, 95% ci 0.98 2.00) to have severe symptoms of covid and approximately 2.4 times more likely to be admitted to an icu, need mechanical ventilation or die compared to non smokers (rr2.4, 95% ci 1.43 4.04), the risk depends on where you live or where you have travelled recently. the risk of infection is higher in areas where a number people have been diagnosed with covid. , while we are still learning about how covid 2019 affects people, older persons and persons with pre existing medical conditions (such as high blood pressure, heart disease, or diabetes) appear to develop serious illness more often than others."
Transmission - Demographics: General,92,are pregnant women more susceptible to the covid virus and will it harm the fetus,United Nations,"older adults and people of any age who have serious underlying medical conditions may be at higher risk for more serious complications from covid., based on available evidence, children do not appear to be at higher risk for covid than adults. , the risk depends on where you are   and more specifically, whether there is a covid outbreak unfolding there. , we do not have information from published scientific reports about the susceptibility of pregnant women to covid. pregnant women experience immunologic and physiologic changes, which might make them more susceptible to viral respiratory infections, including covid. , smoking cigarettes can leave you more vulnerable to respiratory illnesses such as covid. smoking cigarettes is known to cause heart and lung disease and people with underlying heart and lung problems may have increased risk for serious complications from covid., e cigarette use can expose the lungs to toxic chemicals, but whether those exposures increase the risk of covid or the severity of covid outcomes is not known., this is not a good time to be vaping or smoking anything. , younger people seem to be insulated to some extent to protect them from getting particularly sick., researchers do not have information from published scientific reports about susceptibility of pregnant women to this covid., based on available evidence, children do not appear to be at higher risk for covid than adults. , based on currently available information and clinical expertise, older adults and people of any age who have serious underlying medical conditions might be at higher risk for severe illness from covid. , its not known yet whether all of these children are at higher risk for severe illness from covid., most people with disabilities are not inherently at higher risk for becoming infected with or having severe illness from covid., those in complex humanitarian crises, which lack the infrastructure, support, and health systems to mount a comprehensive response. , patients with underlying medical conditions and the elderly, smokers were 1.4 times more likely (rr1.4, 95% ci 0.98 2.00) to have severe symptoms of covid and approximately 2.4 times more likely to be admitted to an icu, need mechanical ventilation or die compared to non smokers (rr2.4, 95% ci 1.43 4.04), the risk depends on where you live or where you have travelled recently. the risk of infection is higher in areas where a number people have been diagnosed with covid. , while we are still learning about how covid 2019 affects people, older persons and persons with pre existing medical conditions (such as high blood pressure, heart disease, or diabetes) appear to develop serious illness more often than others."
Transmission - Demographics: General,92,am i at risk for serious complications from covid if i smoke cigarettes,Food and Drug Administration,"older adults and people of any age who have serious underlying medical conditions may be at higher risk for more serious complications from covid., based on available evidence, children do not appear to be at higher risk for covid than adults. , the risk depends on where you are   and more specifically, whether there is a covid outbreak unfolding there. , we do not have information from published scientific reports about the susceptibility of pregnant women to covid. pregnant women experience immunologic and physiologic changes, which might make them more susceptible to viral respiratory infections, including covid. , smoking cigarettes can leave you more vulnerable to respiratory illnesses such as covid. smoking cigarettes is known to cause heart and lung disease and people with underlying heart and lung problems may have increased risk for serious complications from covid., e cigarette use can expose the lungs to toxic chemicals, but whether those exposures increase the risk of covid or the severity of covid outcomes is not known., this is not a good time to be vaping or smoking anything. , younger people seem to be insulated to some extent to protect them from getting particularly sick., researchers do not have information from published scientific reports about susceptibility of pregnant women to this covid., based on available evidence, children do not appear to be at higher risk for covid than adults. , based on currently available information and clinical expertise, older adults and people of any age who have serious underlying medical conditions might be at higher risk for severe illness from covid. , its not known yet whether all of these children are at higher risk for severe illness from covid., most people with disabilities are not inherently at higher risk for becoming infected with or having severe illness from covid., those in complex humanitarian crises, which lack the infrastructure, support, and health systems to mount a comprehensive response. , patients with underlying medical conditions and the elderly, smokers were 1.4 times more likely (rr1.4, 95% ci 0.98 2.00) to have severe symptoms of covid and approximately 2.4 times more likely to be admitted to an icu, need mechanical ventilation or die compared to non smokers (rr2.4, 95% ci 1.43 4.04), the risk depends on where you live or where you have travelled recently. the risk of infection is higher in areas where a number people have been diagnosed with covid. , while we are still learning about how covid 2019 affects people, older persons and persons with pre existing medical conditions (such as high blood pressure, heart disease, or diabetes) appear to develop serious illness more often than others."
Transmission - Demographics: General,92,if i vape tobacco or nicotine am i at risk for complications from covid,Food and Drug Administration,"older adults and people of any age who have serious underlying medical conditions may be at higher risk for more serious complications from covid., based on available evidence, children do not appear to be at higher risk for covid than adults. , the risk depends on where you are   and more specifically, whether there is a covid outbreak unfolding there. , we do not have information from published scientific reports about the susceptibility of pregnant women to covid. pregnant women experience immunologic and physiologic changes, which might make them more susceptible to viral respiratory infections, including covid. , smoking cigarettes can leave you more vulnerable to respiratory illnesses such as covid. smoking cigarettes is known to cause heart and lung disease and people with underlying heart and lung problems may have increased risk for serious complications from covid., e cigarette use can expose the lungs to toxic chemicals, but whether those exposures increase the risk of covid or the severity of covid outcomes is not known., this is not a good time to be vaping or smoking anything. , younger people seem to be insulated to some extent to protect them from getting particularly sick., researchers do not have information from published scientific reports about susceptibility of pregnant women to this covid., based on available evidence, children do not appear to be at higher risk for covid than adults. , based on currently available information and clinical expertise, older adults and people of any age who have serious underlying medical conditions might be at higher risk for severe illness from covid. , its not known yet whether all of these children are at higher risk for severe illness from covid., most people with disabilities are not inherently at higher risk for becoming infected with or having severe illness from covid., those in complex humanitarian crises, which lack the infrastructure, support, and health systems to mount a comprehensive response. , patients with underlying medical conditions and the elderly, smokers were 1.4 times more likely (rr1.4, 95% ci 0.98 2.00) to have severe symptoms of covid and approximately 2.4 times more likely to be admitted to an icu, need mechanical ventilation or die compared to non smokers (rr2.4, 95% ci 1.43 4.04), the risk depends on where you live or where you have travelled recently. the risk of infection is higher in areas where a number people have been diagnosed with covid. , while we are still learning about how covid 2019 affects people, older persons and persons with pre existing medical conditions (such as high blood pressure, heart disease, or diabetes) appear to develop serious illness more often than others."
