Category,Question ID,Question,Source,Answers
Prevention - General,97,how are you avoiding gaining the covid,Quora,"the best way to prevent illness is to avoid being exposed to the virus. , stay at least 6 feet away from others, and wash your hands often. , regularly and thoroughly clean your hands with an alcohol based hand rub or wash them with soap and water. maintain at least 3 feet distance between yourself and anyone who is coughing or sneezing."
Prevention - General,97,what advice should we follow against covid,Quora,"the best way to prevent illness is to avoid being exposed to the virus. , stay at least 6 feet away from others, and wash your hands often. , regularly and thoroughly clean your hands with an alcohol based hand rub or wash them with soap and water. maintain at least 3 feet distance between yourself and anyone who is coughing or sneezing."
Prevention - General,97,is there a way to not get covid,Author Generated,"the best way to prevent illness is to avoid being exposed to the virus. , stay at least 6 feet away from others, and wash your hands often. , regularly and thoroughly clean your hands with an alcohol based hand rub or wash them with soap and water. maintain at least 3 feet distance between yourself and anyone who is coughing or sneezing."
Prevention - General,97,how is covid prevented,Author Generated,"the best way to prevent illness is to avoid being exposed to the virus. , stay at least 6 feet away from others, and wash your hands often. , regularly and thoroughly clean your hands with an alcohol based hand rub or wash them with soap and water. maintain at least 3 feet distance between yourself and anyone who is coughing or sneezing."
Prevention - Alternative Disinfection,99,what alternatives do i have if there are no hand sanitizers available,United Nations,"if hand sanitizers are not available, hand washing with soap and water is the recommended, and even better, alternative. , handwashing is one of the best ways to protect yourself and your family from getting sick. if soap and water are not readily available, use an alcohol based hand sanitizer with at least 60% alcohol., the efficacy of these disinfection methods against the virus that causes covid is not known., if surfaces are dirty, clean them using detergent or soap and water prior to disinfection. to disinfect, most common epa registered household disinfectants will work. see "
Prevention - Alternative Disinfection,99,should i use soap and water or a hand sanitizer to protect against covid,Center for Disease Control,"if hand sanitizers are not available, hand washing with soap and water is the recommended, and even better, alternative. , handwashing is one of the best ways to protect yourself and your family from getting sick. if soap and water are not readily available, use an alcohol based hand sanitizer with at least 60% alcohol., the efficacy of these disinfection methods against the virus that causes covid is not known., if surfaces are dirty, clean them using detergent or soap and water prior to disinfection. to disinfect, most common epa registered household disinfectants will work. see "
Prevention - Alternative Disinfection,99,how effective are alternative disinfection methods,Center for Disease Control,"if hand sanitizers are not available, hand washing with soap and water is the recommended, and even better, alternative. , handwashing is one of the best ways to protect yourself and your family from getting sick. if soap and water are not readily available, use an alcohol based hand sanitizer with at least 60% alcohol., the efficacy of these disinfection methods against the virus that causes covid is not known., if surfaces are dirty, clean them using detergent or soap and water prior to disinfection. to disinfect, most common epa registered household disinfectants will work. see "
Prevention - Alternative Disinfection,99,what cleaning products should i use to protect against covid,Center for Disease Control,"if hand sanitizers are not available, hand washing with soap and water is the recommended, and even better, alternative. , handwashing is one of the best ways to protect yourself and your family from getting sick. if soap and water are not readily available, use an alcohol based hand sanitizer with at least 60% alcohol., the efficacy of these disinfection methods against the virus that causes covid is not known., if surfaces are dirty, clean them using detergent or soap and water prior to disinfection. to disinfect, most common epa registered household disinfectants will work. see "
Prevention - Alternative Disinfection,99,does alcohol kill covid,Quora,"if hand sanitizers are not available, hand washing with soap and water is the recommended, and even better, alternative. , handwashing is one of the best ways to protect yourself and your family from getting sick. if soap and water are not readily available, use an alcohol based hand sanitizer with at least 60% alcohol., the efficacy of these disinfection methods against the virus that causes covid is not known., if surfaces are dirty, clean them using detergent or soap and water prior to disinfection. to disinfect, most common epa registered household disinfectants will work. see "
Prevention - Alternative Disinfection,99,can i kill covid without hand sanitizer,Author Generated,"if hand sanitizers are not available, hand washing with soap and water is the recommended, and even better, alternative. , handwashing is one of the best ways to protect yourself and your family from getting sick. if soap and water are not readily available, use an alcohol based hand sanitizer with at least 60% alcohol., the efficacy of these disinfection methods against the virus that causes covid is not known., if surfaces are dirty, clean them using detergent or soap and water prior to disinfection. to disinfect, most common epa registered household disinfectants will work. see "
Prevention - Alternative Disinfection,99,is it possible to disinfect surfaces with alternative disinfection methods,Author Generated,"if hand sanitizers are not available, hand washing with soap and water is the recommended, and even better, alternative. , handwashing is one of the best ways to protect yourself and your family from getting sick. if soap and water are not readily available, use an alcohol based hand sanitizer with at least 60% alcohol., the efficacy of these disinfection methods against the virus that causes covid is not known., if surfaces are dirty, clean them using detergent or soap and water prior to disinfection. to disinfect, most common epa registered household disinfectants will work. see "
Prevention - Alternative Disinfection,99,is there a way to kill covid without hand sanitizer,Author Generated,"if hand sanitizers are not available, hand washing with soap and water is the recommended, and even better, alternative. , handwashing is one of the best ways to protect yourself and your family from getting sick. if soap and water are not readily available, use an alcohol based hand sanitizer with at least 60% alcohol., the efficacy of these disinfection methods against the virus that causes covid is not known., if surfaces are dirty, clean them using detergent or soap and water prior to disinfection. to disinfect, most common epa registered household disinfectants will work. see "
Prevention - Alternative Disinfection,99,how do i disinfect if i dont have hand sanitizer,Author Generated,"if hand sanitizers are not available, hand washing with soap and water is the recommended, and even better, alternative. , handwashing is one of the best ways to protect yourself and your family from getting sick. if soap and water are not readily available, use an alcohol based hand sanitizer with at least 60% alcohol., the efficacy of these disinfection methods against the virus that causes covid is not known., if surfaces are dirty, clean them using detergent or soap and water prior to disinfection. to disinfect, most common epa registered household disinfectants will work. see "
Prevention - Alternative Disinfection,99,other than hand sanitizer how can i protect myself from covid,Author Generated,"if hand sanitizers are not available, hand washing with soap and water is the recommended, and even better, alternative. , handwashing is one of the best ways to protect yourself and your family from getting sick. if soap and water are not readily available, use an alcohol based hand sanitizer with at least 60% alcohol., the efficacy of these disinfection methods against the virus that causes covid is not known., if surfaces are dirty, clean them using detergent or soap and water prior to disinfection. to disinfect, most common epa registered household disinfectants will work. see "
Prevention - Alternative Disinfection,99,will alternative disinfection work against covid,Author Generated,"if hand sanitizers are not available, hand washing with soap and water is the recommended, and even better, alternative. , handwashing is one of the best ways to protect yourself and your family from getting sick. if soap and water are not readily available, use an alcohol based hand sanitizer with at least 60% alcohol., the efficacy of these disinfection methods against the virus that causes covid is not known., if surfaces are dirty, clean them using detergent or soap and water prior to disinfection. to disinfect, most common epa registered household disinfectants will work. see "
Prevention - Alternative Disinfection,99,are there ways other than hand sanitizer and soap to kill covid,Author Generated,"if hand sanitizers are not available, hand washing with soap and water is the recommended, and even better, alternative. , handwashing is one of the best ways to protect yourself and your family from getting sick. if soap and water are not readily available, use an alcohol based hand sanitizer with at least 60% alcohol., the efficacy of these disinfection methods against the virus that causes covid is not known., if surfaces are dirty, clean them using detergent or soap and water prior to disinfection. to disinfect, most common epa registered household disinfectants will work. see "
Treatment - Chloroquine,116,are there data showing that chloroquine phosphate or hydroxychloroquine sulfate might benefit patients with covid,Food and Drug Administration,"in the lab, these drugs have been shown to prevent the growth of the virus that causes covid. there are a few reports of patients with covid who received these drugs and improved. some are reports of groups of patients, all of whom received the drug. it is not known whether it was the drug that led to the improvement or whether there were other factors involved. , chloroquine phosphate is only approved for the treatment of malaria, and hydroxychloroquine sulfate is only approved for the treatment of malaria, lupus, and rheumatoid arthritis. , no. hydroxychloroquine sulfate and some versions of chloroquine phosphate are fda approved to treat malaria. , since acidification is crucial for endosome maturation and function, we surmise that endosome maturation might be blocked at intermediate stages of endocytosis,, compare the antiviral activity of cq versus hcq, the dose response curves,  hcq is a safe and successful anti inflammatory agent"
Treatment - Chloroquine,116,may health care providers prescribe chloroquine phosphate or hydroxychloroquine sulfate off label to treat patients with covid,Food and Drug Administration,"in the lab, these drugs have been shown to prevent the growth of the virus that causes covid. there are a few reports of patients with covid who received these drugs and improved. some are reports of groups of patients, all of whom received the drug. it is not known whether it was the drug that led to the improvement or whether there were other factors involved. , chloroquine phosphate is only approved for the treatment of malaria, and hydroxychloroquine sulfate is only approved for the treatment of malaria, lupus, and rheumatoid arthritis. , no. hydroxychloroquine sulfate and some versions of chloroquine phosphate are fda approved to treat malaria. , since acidification is crucial for endosome maturation and function, we surmise that endosome maturation might be blocked at intermediate stages of endocytosis,, compare the antiviral activity of cq versus hcq, the dose response curves,  hcq is a safe and successful anti inflammatory agent"
Treatment - Chloroquine,116,are chloroquine phosphate or hydroxychloroquine sulfate approved by the fda to treat covid,Food and Drug Administration,"in the lab, these drugs have been shown to prevent the growth of the virus that causes covid. there are a few reports of patients with covid who received these drugs and improved. some are reports of groups of patients, all of whom received the drug. it is not known whether it was the drug that led to the improvement or whether there were other factors involved. , chloroquine phosphate is only approved for the treatment of malaria, and hydroxychloroquine sulfate is only approved for the treatment of malaria, lupus, and rheumatoid arthritis. , no. hydroxychloroquine sulfate and some versions of chloroquine phosphate are fda approved to treat malaria. , since acidification is crucial for endosome maturation and function, we surmise that endosome maturation might be blocked at intermediate stages of endocytosis,, compare the antiviral activity of cq versus hcq, the dose response curves,  hcq is a safe and successful anti inflammatory agent"
Treatment - Chloroquine,116,what is the effect of chloroquine(cq) and hydroxychloroquine(hcq) on endosomal maturation and endocytosis in covid treatment,GitHub.com/deepset-ai/COVID-QA,"in the lab, these drugs have been shown to prevent the growth of the virus that causes covid. there are a few reports of patients with covid who received these drugs and improved. some are reports of groups of patients, all of whom received the drug. it is not known whether it was the drug that led to the improvement or whether there were other factors involved. , chloroquine phosphate is only approved for the treatment of malaria, and hydroxychloroquine sulfate is only approved for the treatment of malaria, lupus, and rheumatoid arthritis. , no. hydroxychloroquine sulfate and some versions of chloroquine phosphate are fda approved to treat malaria. , since acidification is crucial for endosome maturation and function, we surmise that endosome maturation might be blocked at intermediate stages of endocytosis,, compare the antiviral activity of cq versus hcq, the dose response curves,  hcq is a safe and successful anti inflammatory agent"
Treatment - Chloroquine,116,in vitro comparison of antiviral activity of chloroquine(cq) and hydroxychloroquine(hcq) against covid,GitHub.com/deepset-ai/COVID-QA,"in the lab, these drugs have been shown to prevent the growth of the virus that causes covid. there are a few reports of patients with covid who received these drugs and improved. some are reports of groups of patients, all of whom received the drug. it is not known whether it was the drug that led to the improvement or whether there were other factors involved. , chloroquine phosphate is only approved for the treatment of malaria, and hydroxychloroquine sulfate is only approved for the treatment of malaria, lupus, and rheumatoid arthritis. , no. hydroxychloroquine sulfate and some versions of chloroquine phosphate are fda approved to treat malaria. , since acidification is crucial for endosome maturation and function, we surmise that endosome maturation might be blocked at intermediate stages of endocytosis,, compare the antiviral activity of cq versus hcq, the dose response curves,  hcq is a safe and successful anti inflammatory agent"
Treatment - Chloroquine,116,evidence of hydroxychloroquine(hcq) being anti inflammatory in covid critically ill patients with elevated plasma cytokines,GitHub.com/deepset-ai/COVID-QA,"in the lab, these drugs have been shown to prevent the growth of the virus that causes covid. there are a few reports of patients with covid who received these drugs and improved. some are reports of groups of patients, all of whom received the drug. it is not known whether it was the drug that led to the improvement or whether there were other factors involved. , chloroquine phosphate is only approved for the treatment of malaria, and hydroxychloroquine sulfate is only approved for the treatment of malaria, lupus, and rheumatoid arthritis. , no. hydroxychloroquine sulfate and some versions of chloroquine phosphate are fda approved to treat malaria. , since acidification is crucial for endosome maturation and function, we surmise that endosome maturation might be blocked at intermediate stages of endocytosis,, compare the antiviral activity of cq versus hcq, the dose response curves,  hcq is a safe and successful anti inflammatory agent"
Treatment - Chloroquine,116,who do you believe about using hydroxychloroquine to treat covid,Yahoo Answers,"in the lab, these drugs have been shown to prevent the growth of the virus that causes covid. there are a few reports of patients with covid who received these drugs and improved. some are reports of groups of patients, all of whom received the drug. it is not known whether it was the drug that led to the improvement or whether there were other factors involved. , chloroquine phosphate is only approved for the treatment of malaria, and hydroxychloroquine sulfate is only approved for the treatment of malaria, lupus, and rheumatoid arthritis. , no. hydroxychloroquine sulfate and some versions of chloroquine phosphate are fda approved to treat malaria. , since acidification is crucial for endosome maturation and function, we surmise that endosome maturation might be blocked at intermediate stages of endocytosis,, compare the antiviral activity of cq versus hcq, the dose response curves,  hcq is a safe and successful anti inflammatory agent"
Treatment - Chloroquine,116,has chloroquine been found to be effective against covid,Quora,"in the lab, these drugs have been shown to prevent the growth of the virus that causes covid. there are a few reports of patients with covid who received these drugs and improved. some are reports of groups of patients, all of whom received the drug. it is not known whether it was the drug that led to the improvement or whether there were other factors involved. , chloroquine phosphate is only approved for the treatment of malaria, and hydroxychloroquine sulfate is only approved for the treatment of malaria, lupus, and rheumatoid arthritis. , no. hydroxychloroquine sulfate and some versions of chloroquine phosphate are fda approved to treat malaria. , since acidification is crucial for endosome maturation and function, we surmise that endosome maturation might be blocked at intermediate stages of endocytosis,, compare the antiviral activity of cq versus hcq, the dose response curves,  hcq is a safe and successful anti inflammatory agent"
Treatment - Chloroquine,116,what is hydroxylchloroquine and is it effective in the treatment of covid,Quora,"in the lab, these drugs have been shown to prevent the growth of the virus that causes covid. there are a few reports of patients with covid who received these drugs and improved. some are reports of groups of patients, all of whom received the drug. it is not known whether it was the drug that led to the improvement or whether there were other factors involved. , chloroquine phosphate is only approved for the treatment of malaria, and hydroxychloroquine sulfate is only approved for the treatment of malaria, lupus, and rheumatoid arthritis. , no. hydroxychloroquine sulfate and some versions of chloroquine phosphate are fda approved to treat malaria. , since acidification is crucial for endosome maturation and function, we surmise that endosome maturation might be blocked at intermediate stages of endocytosis,, compare the antiviral activity of cq versus hcq, the dose response curves,  hcq is a safe and successful anti inflammatory agent"
Treatment - Chloroquine,116,what is trumps motivation for promoting hydroxychloroquine as a covid treatment,Quora,"in the lab, these drugs have been shown to prevent the growth of the virus that causes covid. there are a few reports of patients with covid who received these drugs and improved. some are reports of groups of patients, all of whom received the drug. it is not known whether it was the drug that led to the improvement or whether there were other factors involved. , chloroquine phosphate is only approved for the treatment of malaria, and hydroxychloroquine sulfate is only approved for the treatment of malaria, lupus, and rheumatoid arthritis. , no. hydroxychloroquine sulfate and some versions of chloroquine phosphate are fda approved to treat malaria. , since acidification is crucial for endosome maturation and function, we surmise that endosome maturation might be blocked at intermediate stages of endocytosis,, compare the antiviral activity of cq versus hcq, the dose response curves,  hcq is a safe and successful anti inflammatory agent"
Treatment - Chloroquine,116,are hydroxychloroquine and azithromycin the best treatment protocol for covid,Quora,"in the lab, these drugs have been shown to prevent the growth of the virus that causes covid. there are a few reports of patients with covid who received these drugs and improved. some are reports of groups of patients, all of whom received the drug. it is not known whether it was the drug that led to the improvement or whether there were other factors involved. , chloroquine phosphate is only approved for the treatment of malaria, and hydroxychloroquine sulfate is only approved for the treatment of malaria, lupus, and rheumatoid arthritis. , no. hydroxychloroquine sulfate and some versions of chloroquine phosphate are fda approved to treat malaria. , since acidification is crucial for endosome maturation and function, we surmise that endosome maturation might be blocked at intermediate stages of endocytosis,, compare the antiviral activity of cq versus hcq, the dose response curves,  hcq is a safe and successful anti inflammatory agent"
Treatment - Chloroquine,116,do chloroquine and azithromycin really work to handle severe cases of covid,Quora,"in the lab, these drugs have been shown to prevent the growth of the virus that causes covid. there are a few reports of patients with covid who received these drugs and improved. some are reports of groups of patients, all of whom received the drug. it is not known whether it was the drug that led to the improvement or whether there were other factors involved. , chloroquine phosphate is only approved for the treatment of malaria, and hydroxychloroquine sulfate is only approved for the treatment of malaria, lupus, and rheumatoid arthritis. , no. hydroxychloroquine sulfate and some versions of chloroquine phosphate are fda approved to treat malaria. , since acidification is crucial for endosome maturation and function, we surmise that endosome maturation might be blocked at intermediate stages of endocytosis,, compare the antiviral activity of cq versus hcq, the dose response curves,  hcq is a safe and successful anti inflammatory agent"
Other - Mutation,7,has covid mutated,Yahoo Search,
Other - Mutation,7,does covid mutate,Google Search,
Other - Mutation,7,is covid mutating,Yahoo Search,
Other - Mutation,7,did covid mutate,Yahoo Search,
Other - Mutation,7,will covid mutate,Google Search,
Other - Mutation,7,can covid mutate,Quora,
Other - Mutation,7,will covid mutate,Yahoo Search,
Other - Mutation,7,had covid mutated,Bing Search,
Other - Mutation,7,how likely is the covid virus to mutate and when,Quora,
Other - Mutation,7,is covid currently mutating,Quora,
Other - Mutation,7,what is the rate of mutation in the covid,Quora,
Origin - Source Animal,11,did covid come from bats,Yahoo Search,bats
Origin - Source Animal,11,did covid start with bats,Google Search,bats
Origin - Source Animal,11,did covid come from snakes,Google Search,bats
Origin - Source Animal,11,did covid come from a bat,Yahoo Search,bats
Origin - Source Animal,11,did covid come from animals,Yahoo Search,bats
Origin - Source Animal,11,did covid start with bats,Google Search,bats
Origin - Source Animal,11,did covid come from eating bats,Google Search,bats
Origin - Source Animal,11,in what species did the covid virus likely originate,GitHub.com/deepset-ai/COVID-QA,bats
Origin - Source Animal,11,did covid come from pangolin,Yahoo Search,bats
Origin - Source Animal,11,did covid start with a bat,Yahoo Search,bats
Origin - Source Animal,11,what is the true origin of the covid virus and is the wuhan bat snacking hypothesis credible,Quora,bats
Testing - Methodology,26,how covid test is done,Google Search," there are many tests being used to diagnose covid that the u.s. food & drug administration (fda) has authorized for use during the current emergency. all of these diagnostic tests identify the virus in samples from the respiratory system, such as from nasal or nasopharyngeal swabs, all of these diagnostic tests identify the virus in samples from the respiratory system, such as from nasal or nasopharyngeal swabs. , rrt pcr test,  reverse transcription polymerase chain reaction, the 2109 ncov rna was readily detected in the blood (6 of 57 patients) and the anal swabs (11 of 28 patients). "
